prolific_id,Q0,Q1,Q2,Q3,Q4,Q5,Q6
selftest,q,q,q,q,q,q,q
sub_01,"No, the instructions were easy to understand.",I initially looked at the shape of the bird and picked which was closest in terms of round or straight lines.,"Yes, the length of time seemed exactly right to respond with instinct.","I really liked that at the end of each task, my competency was displayed.","No, the instructions were easy to understand particularly since it used the same keyboard letters.","Yes, the length of time seemed just right to be able to answer with my gut reaction. ","Again, I liked that my competency was displayed at the end of each trial. I felt that the length of each trial was just right, any longer and I worry I would have become distracted."
sub_02,no,"the border, rounded or straight",yes,very interesting game,no,yes,no
sub_03,no all clearly laid explained,shape,yes,no,no,yes,no
sub_04,How if the left and the right are exactly the same with the target?,Looking at the base,yes,No,No,Yes,No
